{
  "id": "mendelssohn-scottish-4-finale",
  "file": "mendelssohn-scottish-4-finale.mp3",
  "title": "Симфония № 3 «Шотландская», IV — Allegro vivacissimo — Allegro maestoso assai",
  "title_original": "Symphony No. 3 «Scottish», Op. 56, IV — Allegro vivacissimo — Allegro maestoso",
  "composer_id": "mendelssohn",
  "performer_id": "musopen-ensemble",
  "year_composed": 1842,
  "year_recorded": 2012,
  "era": "romanticism",
  "style": [
    "symphony"
  ],
  "duration_sec": 682,
  "description_md": "Финал «Шотландской» симфонии — Allegro vivacissimo, переходящее в Allegro maestoso assai. После минорной драматической части — победный мажорный апофеоз. Завершающая хоральная тема в медных — словно гимн, выходящий из тумана первой части.",
  "license": "PD",
  "license_url": "https://creativecommons.org/publicdomain/mark/1.0/",
  "source": "https://archive.org/details/MusopenCollectionAsFlac",
  "credit": "Musopen Kickstarter Project · 2012 · PD"
}