{
  "id": "schubert-moment-3",
  "file": "schubert-moment-3.mp3",
  "title": "Музыкальный момент op. 94 № 3 фа минор",
  "title_original": "Moment musical in F minor, D. 780 No. 3, Op. 94 No. 3",
  "composer_id": "schubert",
  "performer_id": "artur-schnabel",
  "year_composed": 1827,
  "year_recorded": 1937,
  "era": "romanticism",
  "style": ["piano-solo"],
  "duration_sec": 114,
  "description_md": "Самая известная из шести «Музыкальных моментов» op. 94 D 780 — № 3 фа минор, опубликована в 1828 году, за несколько месяцев до смерти Шуберта. «Музыкальный момент» как жанр изобретён Шубертом: короткая, замкнутая фортепианная пьеса без программного содержания, ни этюд, ни соната, ни танец — просто музыкальная мысль, доведённая до завершения за полторы-две минуты. После Шуберта этот формат разрабатывают Шуман, Брамс, Рахманинов.\n\nТретий моменто — пьеса в простом маршевом ритме, с характерным «прихрамыванием» на третьей доле, что превращает её скорее в стилизацию народного танца, чем в марш. Минорная окраска, простая фактура, ABA-форма с возвращением. Записанный Артуром Шнабелем в 1937 году для RCA Victor, фрагмент из набора M 684 — одна из самых ранних эталонных интерпретаций цикла на пластинке.",
  "license": "PD",
  "license_url": "https://creativecommons.org/licenses/publicdomain/",
  "source": "https://archive.org/details/SchubertMomentsMusicaux1-6",
  "credit": "Artur Schnabel · RCA Victor, 1937 · PD"
}
