{
  "id": "grieg-peer-gynt-morning",
  "file": "grieg-peer-gynt-morning.mp3",
  "title": "«Пер Гюнт», сюита № 1 op. 46 — I. Утро",
  "title_original": "Peer Gynt Suite No. 1, Op. 46 — I. Morning Mood",
  "composer_id": "grieg",
  "performer_id": "musopen-ensemble",
  "year_composed": 1875,
  "year_recorded": 2012,
  "era": "romanticism",
  "style": [
    "chamber"
  ],
  "duration_sec": 229,
  "description_md": "Открывающая часть сюиты № 1 из музыки Грига к драме Ибсена «Пер Гюнт» (1867). По сюжету — Пер просыпается в марокканской пустыне после ночи на чужой стороне, но Григ пишет музыку совсем не марокканскую: норвежский пасторальный пейзаж, рассвет в фьорде. Парадокс прижился: «Утро» стало стандартным звуковым клише любого рассвета в кино XX века.\n\nТема — простая нисходящая пентатоника во флейте и гобое, постепенно расширяющаяся в струнный аккорд всего оркестра. Никакой драматургии — только нарастание, кульминация и угасание. Сюита № 1 (1875) собрана Григом из театральной партитуры; премьера состоялась в Кристиании. Запись Musopen Kickstarter Project — студийный профессиональный коллектив, 2012 год, общественное достояние.",
  "license": "PD",
  "license_url": "https://creativecommons.org/publicdomain/mark/1.0/",
  "source": "https://archive.org/details/MusopenCollectionAsFlac",
  "credit": "Musopen Kickstarter Project · 2012 · PD"
}