{
  "id": "borodin-quartet-2-4-finale",
  "file": "borodin-quartet-2-4-finale.mp3",
  "title": "Струнный квартет № 2, IV — Finale. Andante — Vivace",
  "title_original": "String Quartet No. 2, IV — Finale: Andante — Vivace",
  "composer_id": "borodin",
  "performer_id": "musopen-ensemble",
  "year_composed": 1881,
  "year_recorded": 2012,
  "era": "romanticism",
  "style": [
    "string-quartet"
  ],
  "duration_sec": 434,
  "description_md": "Финал Второго квартета — двухчастный, как и у Первого: медленное Andante-вступление, затем быстрое Vivace в форме рондо. После лирической середины квартета Бородин даёт энергичный, почти танцевальный финал. Главная тема Vivace проходит через все четыре голоса с короткими имитациями.",
  "license": "PD",
  "license_url": "https://creativecommons.org/publicdomain/mark/1.0/",
  "source": "https://archive.org/details/MusopenCollectionAsFlac",
  "credit": "Musopen Kickstarter Project · 2012 · PD"
}