{
  "id": "bach-wtc1-fugue-c-major",
  "file": "bach-wtc1-fugue-c-major.mp3",
  "title": "Фуга до мажор ХТК I, BWV 846",
  "title_original": "Fugue in C major, BWV 846, from The Well-Tempered Clavier, Book 1",
  "composer_id": "bach",
  "performer_id": "kimiko-ishizaka",
  "year_composed": 1722,
  "year_recorded": 2018,
  "era": "baroque",
  "style": [
    "fugue",
    "piano-solo"
  ],
  "duration_sec": 116,
  "description_md": "Фуга из «Хорошо темперированного клавира», книга 1, BWV 846, в тональности до мажор. В первой паре Бах задаёт характер всего цикла — простой арпеджированный аккомпанемент в прелюдии (стал известен через переложение Гуно для «Ave Maria») и спокойная четырёхголосная фуга.\n\nЗапись Кимико Ишизака 2018 года на рояле Bösendorfer 280 в студии Teldex Berlin — продолжение проекта Open Goldberg Variations, выпущенного в общественное достояние под CC0.",
  "license": "CC0",
  "license_url": "https://creativecommons.org/publicdomain/zero/1.0/",
  "source": "https://archive.org/details/bach-well-tempered-clavier-book-1",
  "credit": "Kimiko Ishizaka · 2018 · Open Well-Tempered Clavier · CC0"
}