{
  "id": "bach-wtc1-fugue-f-major",
  "file": "bach-wtc1-fugue-f-major.mp3",
  "title": "Фуга фа мажор ХТК I, BWV 856",
  "title_original": "Fugue in F major, BWV 856, from The Well-Tempered Clavier, Book 1",
  "composer_id": "bach",
  "performer_id": "kimiko-ishizaka",
  "year_composed": 1722,
  "year_recorded": 2018,
  "era": "baroque",
  "style": [
    "fugue",
    "piano-solo"
  ],
  "duration_sec": 87,
  "description_md": "Фуга из «Хорошо темперированного клавира», книга 1, BWV 856, в тональности фа мажор. Бах завершил Book 1 в 1722 году в Кётене — 24 пары прелюдий и фуг через все мажорные и минорные тональности, как доказательство возможностей равномерно темперированной настройки.\n\nЗапись Кимико Ишизака 2018 года, Bösendorfer 280, студия Teldex Berlin, продолжение проекта Open Goldberg, CC0.",
  "license": "CC0",
  "license_url": "https://creativecommons.org/publicdomain/zero/1.0/",
  "source": "https://archive.org/details/bach-well-tempered-clavier-book-1",
  "credit": "Kimiko Ishizaka · 2018 · Open Well-Tempered Clavier · CC0"
}